{
  "schema_version": "1.0",
  "policy_id": "conditional-is-medium2k-p32-offline-v1",
  "compiled_space_sha256": "3c0c5a800f1d22739cb1b1a92a308c969cf2f200b0b548e1279fbd943d73f9b3",
  "selection_context": {
    "algorithm_id": "conditional_is_small_proposal",
    "semantic_cohort_id": "conditional_is_small_proposal",
    "graph_sha256": "a46acdc960d12f5dab0af3515d083f1cf6780af34870e1febc01f85e86249cea",
    "accepted_evidence_semantic_classes": ["exact"],
    "workload_id": "gsm8k-medium2k-p32-closed-loop-20260905-transfer",
    "environment_id": "liteserver-159-npu2-ascend910b3-vllm018-20260905",
    "static_features": {
      "workload.arrival_qps": 0.0,
      "workload.context_tokens": 2048,
      "workload.prefix_mode": "unique",
      "workload.prompt_length_regime": "medium2k",
      "workload.requests": 32,
      "workload.workers": 32
    },
    "static_feature_ranges": {
      "workload.prompt_tokens.mean": {
        "minimum": 2000,
        "maximum": 2400
      }
    }
  },
  "query_static_features": {
    "workload.prompt_tokens.mean": 2183.65625,
    "workload.requests": 32
  },
  "baseline_settings": {
    "model_runner": "MRV1",
    "base_max_num_seqs": 40,
    "proposal_max_num_seqs": 48,
    "base_max_num_batched_tokens": 10240,
    "proposal_max_num_batched_tokens": 12288,
    "base_memory_fraction": 0.54,
    "proposal_memory_fraction": 0.36,
    "base_batch_wait_seconds": 0.0,
    "proposal_batch_wait_seconds": 0.02,
    "base_score_priority": 1,
    "base_graph_mode": "FULL_DECODE_ONLY",
    "base_graph_capture_sizes": [1, 2, 4, 8, 16, 24, 32, 40],
    "proposal_graph_mode": "FULL_DECODE_ONLY",
    "proposal_graph_capture_sizes": [1, 2, 4, 8, 16, 24, 32, 40, 48]
  },
  "objective": {
    "target": "performance.completed_qps",
    "direction": "maximize",
    "constraints": [
      {
        "target": "latency.p95_seconds",
        "operator": "<=",
        "value": 170.0
      },
      {
        "target": "quality.accuracy",
        "operator": ">=",
        "value": 0.25
      }
    ]
  },
  "model": {
    "feature_names": [
      "deployment.base_graph_capture_ceiling",
      "deployment.base_max_num_batched_tokens",
      "deployment.base_max_num_seqs",
      "deployment.proposal_graph_capture_ceiling",
      "deployment.proposal_max_num_batched_tokens",
      "deployment.proposal_max_num_seqs",
      "workload.prompt_tokens.mean",
      "workload.requests"
    ],
    "neighbors": 3,
    "distance_power": 2.0,
    "maximum_normalized_distance": 0.25,
    "uncertainty_multiplier": 1.5,
    "maximum_failure_probability": 0.1,
    "minimum_response_rows": 12,
    "minimum_distinct_configurations": 3,
    "minimum_paired_replicates": 2,
    "ranked_candidate_limit": 16
  }
}
